<?xml version="1.0" encoding="UTF-8" standalone="no"?>
<NeptunAdatok xmlns:xsi="http://www.w3.org/2001/XMLSchema-instance" xsi:noNamespaceSchemaLocation="F9PSJA_XMLSchema.xsd">
    
  <!-- Hallgató 1 -->
    
  <Hallgato hid="H1">
        
    <Neptun>KABC12</Neptun>
        
    <Nev>Horváth Anna Mária</Nev>
        
    <SzuletesiDatum>2001-03-15</SzuletesiDatum>
        
    <Cim>
            
      <Varos>Debrecen</Varos>
            
      <Utca>Piac utca</Utca>
            
      <Hazszam>5</Hazszam>
          
    </Cim>
        
    <!-- Többértékű tulajdonság -->
        
    <Email>anna.horvath@gmail.com</Email>
        
    <Email>horvath.anna@uni.hu</Email>
        
    <!-- Többértékű tulajdonság -->
        
    <Telefonszam>+36-30-123-4567</Telefonszam>
        
    <Telefonszam>+36-20-765-4321</Telefonszam>
      
  </Hallgato>
    
  <!-- Hallgató 2 -->
    
  <Hallgato hid="H2">
        
    <Neptun>MBXY34</Neptun>
        
    <Nev>Kovacs Balazs</Nev>
        
    <SzuletesiDatum>1999-11-02</SzuletesiDatum>
        
    <Cim>
            
      <Varos>Budapest</Varos>
            
      <Utca>Fovam ter</Utca>
            
      <Hazszam>8</Hazszam>
          
    </Cim>
        
    <Email>balazs.kovacs@gmail.com</Email>
        
    <Telefonszam>+36-70-111-2222</Telefonszam>
      
  </Hallgato>
    
  <!-- Kurzus 1 -->
    
  <Kurzus kid="K1">
        
    <Kod>INF1</Kod>
        
    <Nev>Bevezetés az informatikába</Nev>
        
    <Kredit>5</Kredit>
        
    <Tipus>Előadás</Tipus>
        
    <TanarRef>TA1</TanarRef>
     
    <!-- FK: tanar aki oktatja -->
      
  </Kurzus>
    
  <!-- Kurzus 2 -->
    
  <Kurzus kid="K2">
        
    <Kod>JAVA2</Kod>
        
    <Nev>Haladó Java</Nev>
        
    <Kredit>6</Kredit>
        
    <Tipus>Gyakorlat</Tipus>
        
    <TanarRef>TA2</TanarRef>
      
  </Kurzus>
  <Kurzus kid="K3">
    <Kod>WEB3</Kod>
    <Nev>Webprogramozás alapjai</Nev>
    <Kredit>4</Kredit>
    <Tipus>Előadás</Tipus>
    <TanarRef>TA1</TanarRef>
  </Kurzus>
    
  <!-- Oktató 1 -->
    
  <Oktato oid="TA1">
        
    <Nev>Dr. Szabo Gabor</Nev>
        
    <Titulus>Egyetemi docens</Titulus>
        
    <Beosztas>Szoftverfejlesztés</Beosztas>
        
    <Email>szabo.gabor@inf.unideb.hu</Email>
        
    <IrodaRef>I10</IrodaRef>
     
    <!-- FK az Iroda elemre -->
      
  </Oktato>
    
  <!-- Oktató 2 -->
    
  <Oktato oid="TA2">
        
    <Nev>Prof. Nagy Erzsebet</Nev>
        
    <Titulus>egyetemi tanár</Titulus>
        
    <Beosztas>Adatbázisok</Beosztas>
        
    <Email>erzsebet.nagy@uni.hu</Email>
        
    <IrodaRef>I11</IrodaRef>
      
  </Oktato>
    
  <!-- Tanszék1 -->
    
  <Tanszek tid="D1">
        
    <Nev>Informatikai Tanszek</Nev>
        
    <Kod>INF</Kod>
        
    <Epulet>A épület</Epulet>
        
    <Telefon>+36-52-444-000</Telefon>
      
  </Tanszek>
    
  <!-- Tanszék 2 -->
    
  <Tanszek tid="D2">
        
    <Nev>Matematika Tanszek</Nev>
        
    <Kod>MTA</Kod>
        
    <Epulet>B épület</Epulet>
        
    <Telefon>+36-52-444-100</Telefon>
      
  </Tanszek>
    
  <!-- Iroda 1 -->
    
  <Iroda iid="I10">
        
    <Epuletszam>A1</Epuletszam>
        
    <Szoba>203</Szoba>
        
    <EpuletNev>Főépület</EpuletNev>
        
    <Megjegyzes>Az oktatók irodája</Megjegyzes>
      
  </Iroda>
    
  <!-- Iroda 2 -->
    
  <Iroda iid="I11">
        
    <Epuletszam>B2</Epuletszam>
        
    <Szoba>101</Szoba>
        
    <EpuletNev>Matematika épület</EpuletNev>
        
    <Megjegyzes>Közös használatú iroda</Megjegyzes>
      
  </Iroda>
    
  <!-- Beiratkozas 1 -->
    

  
  <!-- Beiratkozas 2 -->
    
  <Beiratkozas bid="B2" hallgatoRef="H2" kurzusRef="K2">
        
    <Felev>2024/2</Felev>
        
    <Osztalyzat>5</Osztalyzat>
        
    <Teljesitve>Igen</Teljesitve>
        
    <Jeloles>Gyakorlat teljesítve</Jeloles>
      
  </Beiratkozas>
    
  <!-- Beiratkozas 3 -->
    
  <Beiratkozas bid="B3" hallgatoRef="H1" kurzusRef="K2">
        
    <Felev>2025/1</Felev>
        
    <Osztalyzat>3</Osztalyzat>
        
    <Teljesitve>Nem</Teljesitve>
        
    <Jeloles>Pótvizsga szükséges</Jeloles>
      
  </Beiratkozas>
  
</NeptunAdatok>
